<?xml version="1.0" encoding="UTF-8"?>

<!--

LWM2M XML Schema - LWM2M Editor Schema
   version - 1.0
   date    - 06 Aug 2015

FILE INFORMATION

  Public Reachable Information
    Path: http://www.openmobilealliance.org/tech/profiles
    Name: LWM2M.xsd

NORMATIVE INFORMATION

  Information about this file can be found in the LW M2M online editor

  This is available at http://www.openmobilealliance.org/

  Send comments to technical-comments@mail.openmobilealliance.org

CHANGE HISTORY

21112013 First verion
06082015 Bug Fix to correct mismatch

LEGAL DISCLAIMER

  Use of this document is subject to all of the terms and conditions
  of the Use Agreement located at
  http://www.openmobilealliance.org/UseAgreement.html,
  provided, however, that section (d) under "Documents - Terms 
  of Use" which states, "no modifications are made to such 
  Documents" does not apply to your use.

  The Open Mobile Alliance authorizes you to copy this document, 
  provided that you retain all copyright and other proprietary  
  notices contained in the original materials on any copies of the 
  materials and  that you comply strictly with these terms. This 
  copyright permission does not constitute an endorsement of the 
  products or services. The Open Mobile Alliance assumes no 
  responsibility for errors or omissions in this document.


  Each Open Mobile Alliance member has agreed to use reasonable
  endeavors to inform the Open Mobile Alliance in a timely manner of
  Essential IPR as it becomes aware that the Essential IPR is related
  to the prepared or published specification.  However, the members
  do not have an obligation to conduct IPR searches.  The declared
  Essential IPR is publicly available to members and non-members of
  the Open Mobile Alliance and may be found on the "OMA IPR
  Declarations" list at http://www.openmobilealliance.org/ipr.html.
  The Open Mobile Alliance has not conducted an independent IPR review
  of this document and the information contained herein, and makes no
  representations or warranties regarding third party IPR, including
  without limitation patents, copyrights or trade secret rights.  This
  document may contain inventions for which you must obtain licenses
  from third parties before making, using or selling the inventions.
  Defined terms above are set forth in the schedule to the Open Mobile
  Alliance Application Form.

  NO REPRESENTATIONS OR WARRANTIES (WHETHER EXPRESS OR IMPLIED) ARE
  MADE BY THE OPEN MOBILE ALLIANCE OR ANY OPEN MOBILE ALLIANCE MEMBER
  OR ITS AFFILIATES REGARDING ANY OF THE IPR'S REPRESENTED ON THE "OMA
  IPR DECLARATIONS" LIST, INCLUDING, BUT NOT LIMITED TO THE ACCURACY,
  COMPLETENESS, VALIDITY OR RELEVANCE OF THE INFORMATION OR WHETHER OR
  NOT SUCH RIGHTS ARE ESSENTIAL OR NON-ESSENTIAL.

  THE OPEN MOBILE ALLIANCE IS NOT LIABLE FOR AND HEREBY DISCLAIMS ANY
  DIRECT, INDIRECT, PUNITIVE, SPECIAL, INCIDENTAL, CONSEQUENTIAL, OR
  EXEMPLARY DAMAGES ARISING OUT OF OR IN CONNECTION WITH THE USE OF
  DOCUMENTS AND THE INFORMATION CONTAINED IN THE DOCUMENTS.

  Copyright 2015 Open Mobile Alliance Ltd.  All Rights Reserved.
  Used with the permission of the Open Mobile Alliance Ltd. under the
  terms set forth above.

-->

<xs:schema xmlns:xs="http://www.w3.org/2001/XMLSchema">
  <xs:element name="LWM2M">
    <xs:complexType>
      <xs:sequence>
        <xs:element minOccurs="1" maxOccurs="unbounded" name="Object">
          <xs:complexType>
            <xs:sequence>
              <xs:element name="Name" type="xs:string" />
              <xs:element name="Description1" type="xs:string" />
              <xs:element name="ObjectID" type="xs:unsignedshort" />
              <xs:element name="ObjectURN" type="xs:string" />
              <xs:element name="MultipleInstances" >
                <xs:simpleType>
                  <xs:restriction base="xs:string">
                    <xs:enumeration value="Multiple"/>
                    <xs:enumeration value="Single"/>
                  </xs:restriction>
                </xs:simpleType>
              </xs:element>
              <xs:element name="Mandatory" >
                <xs:simpleType>
                  <xs:restriction base="xs:string">
                    <xs:enumeration value="Mandatory"/>
                    <xs:enumeration value="Optional"/>
                  </xs:restriction>
                </xs:simpleType>
              </xs:element>
              <xs:element name="Resources">
                <xs:complexType>
                  <xs:sequence>
                    <xs:element maxOccurs="unbounded" name="Item">
                      <xs:complexType>
                        <xs:sequence>
                          <xs:element name="Name" type="xs:string" />
                          <xs:element name="Operations" >
                            <xs:simpleType>
                              <xs:restriction base="xs:string">
                                <xs:enumeration value="R"/>
                                <xs:enumeration value="W"/>
                                <xs:enumeration value="RW"/>
                                <xs:enumeration value="E"/>
                                <xs:enumeration value="RE"/>
                                <xs:enumeration value="WE"/>
                                <xs:enumeration value="RWE"/>
                                <xs:enumeration value=""/>
                              </xs:restriction>
                            </xs:simpleType>
                          </xs:element>
                          <xs:element name="MultipleInstances" >
                            <xs:simpleType>
                              <xs:restriction base="xs:string">
                                <xs:enumeration value="Multiple"/>
                                <xs:enumeration value="Single"/>
                              </xs:restriction>
                            </xs:simpleType>
                          </xs:element>
                          <xs:element name="Mandatory" >
                            <xs:simpleType>
                              <xs:restriction base="xs:string">
                                <xs:enumeration value="Mandatory"/>
                                <xs:enumeration value="Optional"/>
                              </xs:restriction>
                            </xs:simpleType>
                          </xs:element>
                          <xs:element name="Type" >
                            <xs:simpleType>
                              <xs:restriction base="xs:string">
                                <xs:enumeration value="String"/>
                                <xs:enumeration value="Integer"/>
                                <xs:enumeration value="Float"/>
                                <xs:enumeration value="Boolean"/>
                                <xs:enumeration value="Opaque"/>
                                <xs:enumeration value="Time"/>
                                <xs:enumeration value="Integer"/>
                                <xs:enumeration value=""/>
                              </xs:restriction>
                            </xs:simpleType>
                          </xs:element>
                          <xs:element name="RangeEnumeration" type="xs:string" />
                          <xs:element name="Units" type="xs:string" />
                          <xs:element name="Description" type="xs:string" />
                        </xs:sequence>
                        <xs:attribute name="ID" type="xs:unsignedshort" use="required" />
                      </xs:complexType>
                    </xs:element>
                  </xs:sequence>
                </xs:complexType>
              </xs:element>
              <xs:element name="Description2" type="xs:string" />
            </xs:sequence>
            <xs:attribute name="ObjectType" type="xs:string" use="required" />
          </xs:complexType>
        </xs:element>
      </xs:sequence>
    </xs:complexType>
  </xs:element>
</xs:schema>